{
  "$schema": "../schemas/test_plan.schema.json",
  "name": "WebUI Load Test - test.k6.io",
  "environment": "dev",
  "execution_mode": "parallel",
  "global_load_profile": {
    "executor": "ramping-vus",
    "startVUs": 0,
    "stages": [
      { "duration": "5s", "target": 3 },
      { "duration": "15s",  "target": 3 },
      { "duration": "5s", "target": 0  }
    ]
  },
  "noCookiesReset": true,
  "user_journeys": [
    {
      "name": "buyanimal_1_framework_lifecycle",
      "scriptPath": "buyanimal_1_framework_lifecycle.js",
      "weight": 50
    },
    {
      "name": "buyanimal_1_framework_lifecycle_copy",
      "scriptPath": "buyanimal_1_framework_lifecycle_copy.js",
      "weight": 50
    }
  ],
  "global_sla": {
    "p99": 2000,
    "errorRate": 10
  },
  "journey_slas": {
    "buyanimal_1_framework_lifecycle": {
      "p95": 1500,
      "errorRate": 5
    }
  },
  "transaction_slas": {
    "tx01_launch": { "p95": 800 },
    "tx02_login": { "p95": 1000 },
    "tx08_click_confirm": { "p95": 1500, "p99": 3000 }
  }
}
